question,answer,topic,source_url
How can I improve sleep quality?,Keep a regular schedule reduce late caffeine and limit screens before bedtime.,health,
What are simple ways to reduce stress?,Use breathing breaks movement social support and realistic planning of tasks.,health,
How much physical activity is healthy each week?,Many adults benefit from around 150 minutes of moderate activity weekly plus strength work.,health,
How can I build a healthy daily routine?,Start with consistent sleep meals hydration movement and short planning blocks.,health,
Why is hydration important for health?,Fluids support temperature control circulation cognition and physical performance.,health,
What are signs I should seek medical advice?,Persistent severe or worsening symptoms should be checked by a qualified professional.,health,
How can I avoid burnout at work or study?,Set boundaries schedule recovery time and break large goals into manageable steps.,health,
Is walking every day useful for health?,Regular walking supports cardiovascular fitness mood and long-term wellbeing.,health,
